Name,Category,Type,Price Range,Rating,No of Reviews,Description,Address,Latitude,Longitude
Salem Wax Museum,Museum,Wax museum,,3.6,343,Local history exhibits & a souvenir shop Closing soon: 8:00 PM,288 Derby St,42.520403,-70.891532
Danforth Art School,Museum,Art museum,,4.7,24,Grand 19th century library & art museum,14 Vernon St,42.330301,-71.084237
Peabody Essex Museum Shop,Museum,Museum,,4.7,18,"Maritime themed gifts, prints & apparel",161 Essex St,42.352219,-71.058247
The Salem Museum,Museum,History museum,,4.3,27,Local history in the Old Town Hall,32 Derby Square,42.521145,-70.894089
Quaker Meeting House,Museum,Historical place museum,,5,1,Boston sports memorabilia & tours,"6 Chestnut St, Boston, MA 02108",42.523011,-70.891735
Peabody Historical Fire Museum,Museum,History museum,,4.7,3,Modern venue for American/Asian artwork,43 Felton St,42.361926,-71.053434
The Old Ordinary of The Hingham Historical Society,Museum,Museum,,4,4,Art museum with 30 acres of sculptures,21 Lincoln St,42.299572,-71.060061
Wenham Museum,Museum,Museum,,4.6,117,Striking waterfront modern art museum,132 Main St,42.374981,-71.064267
Abstract Oil Paintings by Maura Cunningham,Museum,Art gallery,,4.5,2,Firefighting history in an old firehouse,59 Wareham St,42.339187,-71.067531
American Heritage Museum,Museum,Museum,,4.7,47,Museum in pre Civil War era building,568 Main St,42.391603,-71.504897
Boott Cotton Mills Museum,Museum,History museum,,4.7,178,Industrial museum with guided tours,115 John St,42.647422,-71.306595
Worcester Art Museum,Museum,Art museum,,4.7,884,Encyclopedic collection of art treasures,55 Salisbury St,42.273058,-71.801447
Museum Square,Museum,Museum,,4.4,55,Historic 17th century home with tours,2 Museum Square,42.338268,-71.094753
Manchester Historical Museum,Museum,Museum,,4.9,9,Early 19th century furnishings & art,10 Union St,42.360511,-71.056912
Franklin Historical Museum,Museum,Museum,,5,12,"Artifacts from Egypt, Israel & more",80 W Central St,42.359003,-71.053147
Fruitlands Museum,Museum,Art museum,,4.7,196,19th century American culture displays,102 Prospect Hill Rd,42.508343,-71.610215
RISD Museum,Museum,Museum,,4.7,731,Center of fine & decorative arts,20 N Main St,42.364307,-71.052681
Boston tea party museum,Museum,Museum,,5,1,Horror museum & seasonal haunted house,298 Lee Fort Terrace,42.329525,-71.035072
Dedham Historical Society,Museum,Museum,,3.6,343,Local history exhibits & a souvenir shop Closing soon: 8:00 PM,612 High St,42.248268,-71.174492
Museum of Russian Icons,Museum,Museum,,4.8,147,Religious art & Russian tea room,203 Union St,42.415557,-71.683795
The Little Red Shop Museum,Museum,Museum,,4,7,"Maritime themed gifts, prints & apparel",12 Hopedale St,42.359747,-71.127031
Ipswich Museum,Museum,Museum,,4.9,7,Local history in the Old Town Hall,54 S Main St,42.286963,-71.096474
Skywalk Observatory,Museum,Museum,,4.5,2200,Views of Boston from the 50th floor,800 Boylston St,42.346277,-71.082801
Quim Alcantara Atelier,Museum,Arts organization,,4.7,3,Modern venue for American/Asian artwork,303 Third St #320,42.337314,-71.046917
General Artemas Ward Museum,Museum,Museum,,4.8,5,Historical home of an American general,786 Main St,42.295701,-71.696994
Custom House Maritime Museum,Museum,Museum,,4.6,67,Nautical exhibits in historic quarters,25 Water St,42.288806,-71.040598
Lura Woodside Watkins Museum,Museum,Museum,,4.6,117,Striking waterfront modern art museum,9 Pleasant St,42.318117,-71.059241
Museum of Printing,Museum,Museum,,4.9,32,Printing & typesetting technology museum,15 Thornton Ave,42.321276,-71.093486
Worcester Historical Museum,Museum,Museum,,4.4,14,Institution devoted to Worcester history,30 Elm St,42.300664,-71.053441
Art Complex Museum,Museum,Museum,,4.9,7,Industrial museum with guided tours,189 Alden St,42.044023,-70.687617
Currier Museum of Art,Museum,Art museum,,4.7,565,Grand European & American art collection,150 Ash St,42.997737,-71.455373
Robbins Museum of Archaeology,Museum,Museum,,4.6,20,Early 19th century furnishings & art,17 Jackson St,42.355841,-71.06132
James Babson Museum,Museum,Historical place museum,,4,2,"Artifacts from Egypt, Israel & more",291 Main St,42.377757,-71.067031
New Bedford Whaling Museum,Museum,Museum,,4.7,567,Exhibits & history of whaling industry,18 Johnny Cake Hill,42.347714,-71.062771
Haffenreffer Museum of Anthropology,Museum,Science museum,,4.2,21,Ancient artifacts plus events & programs,21 Prospect St,42.375397,-71.057691
Halifax Historical Commission,Museum,History museum,,3.8,4,Horror museum & seasonal haunted house,South St,42.351569,-71.057066
Devens Museum Field,Museum,Museum,,5,1,Local history exhibits & a souvenir shop Closing soon: 8:00 PM,5 Antietam St,42.550391,-71.608327
Botany Libraries and Archives,Museum,Museum,,4.8,147,Religious art & Russian tea room,22 Divinity Ave,42.378863,-71.114617
Jason Russell House,Museum,Historical landmark,,4.9,13,"Maritime themed gifts, prints & apparel",7 Jason St,42.331772,-71.044141
Old Town Hall Museum,Museum,Museum,,4.9,7,Local history in the Old Town Hall,310 Main St,42.378047,-71.067881
Springfield Museums,Museum,Museum,,4.6,1307,"Science, history & art on display",21 Edwards St,42.382828,-70.987202
Back Bay Fens,Park,Park ,,4.4,456,Urban park with gardens & play areas,100 Park Dr,42.340395,-71.098644
Titus Sparrow Park,Park,Park ,,4.5,151,Urban park with sports courts & events,200 W Newton St,42.343356,-71.078961
Childe Hassam Park,Park,Park ,,4.6,7, ,324 Columbus Ave,42.346144,-71.074546
Harriet Tubman Square,Park,Park ,,4.8,48,Picturesque plaza with monument,450 Columbus Ave,42.343778,-71.077481
Commonwealth Avenue Mall,Park,Park ,,4.6,183,Scenic greenway with historic monuments,484 Commonwealth Avenue,42.348557,-71.094221
Ramler Park,Park,Park ,,4.8,43,"Petite, decorative urban green space",130 Peterborough St,42.342571,-71.100714
Blackstone Square,Park,Park ,,4.5,74,Cozy green space for picnics & dogs,1535 Washington St,42.339534,-71.073389
Franklin Square,Park,Park ,,4.1,64,City park with trees & a fountain,,42.370567,-71.026964
Butterfly Meadow,Park,Garden ,,5,1, ,SW Corridor Park,42.370567,-71.026964
Riverway,Park,Park ,,4.5,34,Scenic park with forest trails & bridges,Riverway,42.340208,-71.109684
Fiedler Field,Park,Park ,,4.7,81, ,Charles River Esplanade,42.356241,-71.075766
Braddock Park,Park,Park ,,5,1, ,,42.370567,-71.026964
Fort Washington Park,Park,Park ,,3.9,31, ,95 Waverly St,42.319792,-71.078002
Boston Public Garden,Park,City park ,,4.8,7993,Tranquil 19th century urban park,4 Charles St,42.354244,-71.069804
Magazine Beach Park,Park,Park ,,4.3,151,Park with a pool & historic buildings,668 Memorial Dr,42.354876,-71.114306
Fulmore Park,Park,Park ,,4.2,20,Site for childrens' play opportunities,,42.370567,-71.026964
Longwood Mall,Park,Park ,,4.8,28, ,,42.370567,-71.026964
BU Beach,Park,Park ,,4.5,66,An on campus green space for unwinding,270 Bay State Rd,42.350791,-71.105482
Boston Common,Park,Park ,,4.7,17883,Venerable park with historic cred,139 Tremont St,42.355444,-71.063828
Statler Park,Park,Park ,,4.5,14,Small city park with fountain & benches,243 Stuart St,42.350656,-71.068928
Monmouth Street Park,Park,Park ,,3,1,"Petite, decorative urban green space",86 Monmouth St,42.379734,-71.038825
Winthrop Square,Park,Park ,,4.5,84,Park with a playground & rose garden,St Paul St & Freeman St,42.370567,-71.026964
Union Park,Park,Park ,,4.4,13, ,,42.370567,-71.026964
Riverway park,Park,Park ,,5,3,City park with trees & a fountain,Unnamed Road,42.370567,-71.026964
Highland Park,Park,Park ,,4.5,14,Green space dating to the 19th century,980 Harrison Ave,42.332313,-71.078431
Phillips Street Park,Park,Park ,,4.4,8,Scenic park with forest trails & bridges,21 Phillips St,42.360441,-71.067364
Peters Park,Park,Park ,,4.3,186,"Playground, dog run & basketball courts",1277 Washington St,42.342741,-71.067369
Bessie Barnes Park,Park,Park ,,5,1, ,,42.370567,-71.026964
Dana Park,Park,Park ,,4.7,129,Green square with a playground,Corporal McTernan and Lawrence Streets,42.370567,-71.026964
Murphy Playground,Park,Park ,,3.9,16, ,,42.370567,-71.026964
University Park Commons,Park,Park ,,4.4,48,Sculpture filled green space at MIT,65 Sidney St,42.313789,-71.052636
Kevin W. Fitzgerald Park,Park,Park ,,4.4,66,Hillside city park with a dog run,157 St Alphonsus St,42.332038,-71.103252
Brookline Avenue Playground,Park,Park ,,4.6,71,Dog friendly park with an athletic field,575 Brookline Ave,42.335842,-71.110607
Eliot Norton Park,Park,Park ,,4.2,44,Small green space with a playground,,42.370567,-71.026964
Madison Park Village,Park,Park ,,4.1,38,Venerable park with historic cred,,42.370567,-71.026964
Jill Brown Rhone Park,Park,Park ,,4.4,9,Small city park with fountain & benches,371 Massachusetts Ave #363,42.341721,-71.083804
Rose Kennedy Greenway Dewey Square,Park,Park ,,4.7,3,"Petite, decorative urban green space",125 Union Park St,42.339574,-71.065327
Rose Kennedy Greenway Chinatown Park,Park,Dog park ,,4.6,79,Fenced in neighborhood dog run,29 Tudor St,42.336221,-71.053358
Rose Kennedy Greenway Uncle Frank & Auntie Kay Chin Park,Park,State park ,,4.1,22,Colonial era house & green space,183 Roxbury St,42.330527,-71.090701
Furnished Quarters Church Park,Park,Park ,,4.4,113,City park with trees & a fountain,33 Griggs Rd,42.344451,-71.086496
Hodgkins Curtin Park,Park,Park ,,4.3,37,Outdoor recreation for all ages,60 Columbia St,42.352767,-71.058421
Hodgkins Curtin Park,Park,Park ,,4.5,13,Green space dating to the 19th century,Linden St,42.305511,-71.061279
Southwest Corridor ParkTennis Courts,Park,Park ,,4.5,6,Scenic park with forest trails & bridges,10 Corporal McTernan St,42.335451,-71.090346
ams National Historical Park,Park,Park ,,4.6,703,Urban park with open lawns & fountains,Atlantic Ave,42.356124,-71.050749
John Adams Birthplace Adams National Historical Park,Park,Park ,,4.6,290,Popular area with sports fields & trails,217 Jamaicaway,42.326209,-71.114257
DoubleTree Suites by Hilton Hotel Boston Cambridge,Park,Garden ,,4.5,47,Small flower filled spot with a fountain,73 Park Dr,42.342515,-71.095542
"Regus Massachusetts, Boston",Park,Dog park ,,5,1, ,1205 Washington St,42.342965,-71.067065
Boston Tango in the Park only in July & August,Park,Park ,,4.6,331,Green space with a market & food vendors,Atlantic Ave,42.356124,-71.050749
DoubleTree by Hilton Hotel Boston Downtown,Park,Park ,,4.4,10,Hillside city park with a dog run,71 Rogers St,42.328909,-71.055363
Brookline Parks and Open SpacePark Maintenance / Forestry,Park,Park ,,3.9,18,Small urban oasis with trees & benches,,42.370567,-71.026964
North Point Park,Park,Park ,,4.6,301,Walking trails & scenic river views,6 Museum Way,42.338117,-71.095161
Christopher Columbus Waterfront Park,Park,Park ,,4.6,1573,Sprawling urban hangout with water views,Atlantic Ave,42.356124,-71.050749
Sennott Park,Park,Park ,,4.4,140,Green area with many sports fields,305 Broadway,42.338537,-71.050781
Danny Lewin Park,Park,Park ,,4.4,9,Small city park with fountain & benches,130 Broadway,42.349677,-71.066748
Tai Tung Park,Park,Park ,,4.5,4,"Petite, decorative urban green space",110 Tyler St,42.348341,-71.061631
Rose Kennedy Greenway Chinatown Park,Park,Park ,,4.1,37,Paved square & a traditional gateway,34W Lincoln St,42.299871,-71.059846
Charles Park,Park,Park ,,4.7,31,Colonial era house & green space,,42.370567,-71.026964
National Parks & Conservation,Park,Park ,,5,1,City park with trees & a fountain,41 Winter St,42.356147,-71.061621
Norman B. Leventhal Park,Park,Park ,,4.6,522,An oasis of green with a fountain,130 Congress St,42.356554,-71.055814
Underground at Ink Block,Park,Park ,,4.3,58,Green space dating to the 19th century,90 Traveler St,42.344254,-71.062564
Boston National Historical Park,Park,National park ,,4.7,5879,Educational programs & guided tours,"Building 5, Charlestown Navy Yard",42.370567,-71.026964
Corporal Burns Playground,Park,Park ,,4.9,41,Park with basketball & river access,Memorial Dr,42.367388,-71.116074
Lechmere Canal Park,Park,Park ,,4.7,97,A serene park with a water fountain,,42.370567,-71.026964
Temple Street Park,Park,Park ,,4,4,Popular area with sports fields & trails,46 Temple St,42.360044,-71.063495
Southwest Corridor Park,Park,State park ,,4.3,181,Small flower filled spot with a fountain,38 New Heath St,42.326083,-71.099133
Post Office Square,Park,Park ,,4.6,248,Landmark green space with a cafe,,42.370567,-71.026964
Corey Hill Outlook Park,Park,Park ,,4.6,182,Greenspace with a playground & paths,Summit Ave,42.342411,-71.133414
Justice Edward O. Gourdin Veterans Memorial Park,Park,Memorial park ,,5,1,Hillside city park with a dog run,2405 Washington St,42.328848,-71.085823
Armenian Heritage Park,Park,Park ,,4.8,73,Urban oasis with a labyrinth,Rose Fitzgerald Kennedy Greenway,42.370567,-71.026964
Rose Kennedy Greenway,Park,Park ,,4.6,56,Area with a carousel & ever changing art,Atlantic Ave,42.356124,-71.050749
Emerson Garden,Park,Park ,,4.8,45,Sprawling urban hangout with water views,82 Davis Ave,42.374991,-71.036384
Joe Moakley Park,Park,Park ,,4.2,635,Park with ball fields & spray area,1005 Columbia Rd,42.327258,-71.050393
Greenway Lincoln Street Triangle,Park,Park ,,4.4,140,Green area with many sports fields,,42.370567,-71.026964
Children's Wharf Park,Park,Park ,,4.6,27,Waterside locale with tables & views,,42.370567,-71.026964
Rolling Bridge Park,Park,Park ,,4,11,Green spot with Cabot Cove views,61 Dorchester Ave,42.344856,-71.057469
Gold Star Mothers Park,Park,Park ,,4.5,76,Compact city park with ball & play areas,123 Gore St,42.372315,-71.083869
Reardon Square Park,Park,Park ,,4.7,31,Colonial era house & green space,8 Hampshire St,42.365519,-71.091221
Mozart Park,Park,City park ,,4.3,4,City park with trees & a fountain,267 Centre St,42.293567,-71.061781
Galaxy Park,Park,Park ,,4.6,522,An oasis of green with a fountain,238 Main St,42.287319,-71.096414
Riverbend Park,Park,Park ,,4.7,58,Snug green space along the water,344 Broadway 2nd Floor,42.338337,-71.049711
Orchard Park Maintenance,Park,Park ,,3.9,9,Educational programs & guided tours,20 Prescott St,42.328206,-71.075356
Silva Park,Park,Park ,,4.4,15,Park with basketball & river access,54 Sciarappa St,42.370744,-71.081589
Mary Soo Hoo Park,Park,Park ,,3.5,2,A serene park with a water fountain,Hudson St,42.349289,-71.060672
Horatio Harris Park,Park,Park ,,4.2,80,Popular area with sports fields & trails,85 Harold St,42.318625,-71.089997
Lincoln Park,Park,Park ,,4.7,127,Multi use community recreation area,290 Washington St,42.357317,-71.057441
Fenway Park,Park,Stadium ,,4.8,19830,Legendary home of the Red Sox,4 Yawkey Way,42.346723,-71.098681
Cambridge Common,Park,Park ,,4.5,482,Landmark with play areas & bike paths,Waterhouse St & Massachusetts Ave,42.370567,-71.026964
Green Rose Heritage Park,Park,Park ,,5,1,Hillside city park with a dog run,238 Broadway,42.339647,-71.051924
Langone Park,Park,Park ,,4.5,113,Bocce ball courts & scenic surroundings,543 Commercial Street,42.368358,-71.05665
Centanni Park,Park,Park ,,5,8,Area with a carousel & ever changing art,,42.370567,-71.026964
Clark Playground,Park,Park ,,4.6,44,Sprawling urban hangout with water views,195 Cypress St,42.327738,-71.125259
The Underground Dog Park,Park,Dog park ,,4,2,Park with ball fields & spray area,S Bay Harbor Trail,42.333771,-71.066579
Franklin Park Zoo,Park,Park ,,4.3,3150,"Gardens, a zoo & an arboretum",1 Franklin Park Rd,42.302973,-71.086402
Ringer Park,Park,Park ,,4.2,67,Green space with play areas & basketball,85 Allston St,42.294301,-71.067399
Perry Park,Park,Park ,,4.4,40,Shady public green space with playground,355 Washington St,42.356697,-71.059401
Franklin Park,Park,Park ,,4.5,1948,Sizable urban getaway with a zoo & more,1 Franklin Park Rd,42.302973,-71.086402
City Square Park,Park,Park ,,4.6,87,Tiny landscaped park with sculptures,,42.370567,-71.026964
Cutillo Park,Park,Park ,,2.3,3,City park with trees & a fountain,,42.370567,-71.026964
Fan Pier Park,Park,Park ,,4.8,296,Landscaped waterfront with sitting areas,,42.370567,-71.026964
Joan Lorentz Park,Park,Park ,,4.3,87,Urban green space & place to play tennis,,42.370567,-71.026964
Cambridge Parks Maintenance,Park,Park ,,3.9,9,Educational programs & guided tours,147 Hampshire St,42.370457,-71.096671
Riverside City Park,Park,Park ,,4.4,15,Park with basketball & river access,,42.370567,-71.026964
RUFF North End Dog Park,Park,Dog park ,,4.5,13,A serene park with a water fountain,BOST,42.370567,-71.026964
Christian Herter Park,Park,Park ,,4.7,269,Public park with playgrounds & gardens,,42.370567,-71.026964
Mansfield Street Dog Park,Park,Dog park ,,3.1,13,Multi use community recreation area,556 Lincoln St,42.356822,-71.130733
Dennis Street Park,Park,Park ,,3.9,26,Legendary home of the Red Sox,143 Moreland St,42.321977,-71.074921
Lawton Playground,Park,Park ,,4.4,18,Leafy park with play equipment & benches,,42.370567,-71.026964
The Lawn On D,Park,Park ,,4.4,1491,Park with live music & lawn games,420 D St,42.343841,-71.045383
Wormwood Park,Park,Park ,,5,2,Bocce ball courts & scenic surroundings,,42.370567,-71.026964
Rena Park,Park,Park ,,3.7,3,Area with a carousel & ever changing art,300 N Harvard St,42.360108,-71.128091
Schick Park,Park,Park ,,3.9,29,Small park with a field & a playground,,42.370567,-71.026964
North Point Park Island,Park,Park ,,4.2,5,Park with ball fields & spray area,1 North Point Blvd,42.319986,-71.040931
Conway Park,Park,Park ,,4.4,66,Park with athletic fields & courts,,42.370567,-71.026964
Rose Kennedy Greenway Uncle Frank & Auntie Kay Chin Park,Park,Park ,,4.2,90,Plaza & walkway with gardens & waterfall,John F Fitzgerald Surface Rd,42.352016,-71.058873
Common park,Park,Park ,,5,6,Shady public green space with playground,,42.370567,-71.026964
Prospect Hill Park,Park,Park ,,4.5,187,Historic site with panoramic views,,42.370567,-71.026964
Beecher Park,Park,Park ,,4.3,11,Tiny landscaped park with sculptures,147 Chestnut Ave,42.317812,-71.106473
Channel Park,Park,Park ,,4.5,2,City park with trees & a fountain,2164 S Bay Harbor Trail,42.348264,-71.039777
Nunziato Field and Dog Park,Park,Dog park ,,4.2,95,Off leash play area for furry friends,7 Putnam St,42.382257,-71.033591
Brookline Reservoir Park,Park,Park ,,4.5,168,Historic reservoir with a jogging track,,42.370567,-71.026964
Glen Park,Park,Park ,,4.5,30,Recreation area with playground & fields,150 Glen St,42.382462,-71.086838
Alfred Vellucci Park,Park,Park ,,4.4,15,Park with basketball & river access,Cambridge St,42.361351,-71.064985
Child Street Park,Park,Park ,,4.5,13,A serene park with a water fountain,15 Child St,42.259013,-71.127761
Trellis at Christopher Columbus park,Park,City park ,,4.5,2,Public park with playgrounds & gardens,110 Atlantic Ave,42.361013,-71.052184
Park Swings,Park,Park ,,3.1,13,Multi use community recreation area,204 Freedom Trail,42.362591,-71.055928
Alden Play Area,Park,Park ,,4.7,22,Legendary home of the Red Sox,,42.370567,-71.026964
Flaherty Park,Park,Park ,,4.4,18,Leafy park with play equipment & benches,B St,42.339657,-71.055155
South Boston Bark Park,Park,Dog park ,,4,66,Park with live music & lawn games,1280 Columbia Rd,42.330593,-71.047766
Artesani Playground Wading Pool and Spray Deck,Park,State park ,,4.6,214,Bocce ball courts & scenic surroundings,1255 Soldiers Field Rd,42.364341,-71.137832
Eastport Park,Park,Park ,,4.4,7,Landscaped open air sculpture garden,,42.370567,-71.026964
Edwards Playground,Park,Park ,,4.3,24,Park with ball fields & spray area,10 Eden St,42.396801,-71.033879
Charlestown Naval Shipyard Park,Park,Park ,,4.6,13,Plaza & walkway with gardens & waterfall,36 1st Ave,42.374934,-71.053993
Pilot House Park,Park,Park ,,4.4,10,Small green space on Harborwalk trail,,42.370567,-71.026964
Symphony Park,Park,Park ,,4.7,18,Historic site with panoramic views,46 Pearl St,42.314977,-71.059321
Franklin Street Park,Park,Park ,,4.8,4,Tiny landscaped park with sculptures,493 Franklin St,42.367705,-71.110369
Leather District Park,Park,Park ,,4.5,6,City park with trees & a fountain,,42.370567,-71.026964
Medal of Honor Park,Park,Park ,,4.3,72,Off leash play area for furry friends,775 E 1st St,42.337587,-71.031878
Piers Park Sailing Center,Park,Park ,,4.7,257,"Waterfront recreation, fitness & sailing",95 Marginal St,42.366511,-71.039078
Danehy Park,Park,Park ,,4.6,533,Site for outdoor activities & a dog park,99 Sherman St,42.320639,-71.082966
Marine Industrial Park,Park,Park ,,3.8,21,Business hub with a brewery & cruises,,42.370567,-71.026964
Flagstaff Park,Park,Park ,,4,2,A serene park with a water fountain,,42.370567,-71.026964
Somerville Junction Park,Park,Park ,,4.5,14,Public park with playgrounds & gardens,,42.370567,-71.026964
Riverbend Park,Park,Park ,,4.5,6,Multi use community recreation area,214 Mt Auburn St,42.374634,-71.131727
Charlestown Veterans Memorial Park,Park,Memorial park ,,4.7,22,Legendary home of the Red Sox,12 Freedom Trail,42.372397,-71.061828
Lexington Park,Park,Park ,,4.5,57,Leafy park with play equipment & benches,45 Lexington Ave,42.377643,-71.059886
Elma Lewis Playhouse in the Park,Park,Park ,,4.7,3,Park with live music & lawn games,Franklin Park Rd,42.303573,-71.085405
Seaport Common,Park,Park ,,4.5,69,Bocce ball courts & scenic surroundings,85 Northern Ave,42.352283,-71.045031
Thomas M. Menino Park,Park,Park ,,4.7,86,Area with a carousel & ever changing art,98 16th St,42.377882,-71.049352
Edward L. Leathers Community Park,Park,Park ,,4.4,21,Landscaped open air sculpture garden,,42.370567,-71.026964
Park,Park,Park ,,4,3,Park with ball fields & spray area,49 Stillings St,42.351192,-71.046863
Hodgkins Curtin Park,Park,Park ,,4.5,60,Small green space on Harborwalk trail,A1 Alpine Pl,42.399559,-71.124948
Hodgkins Curtin Park,Park,Dog park ,,2.3,3,Historic site with panoramic views,21 Caldwell St,42.384981,-71.078133
Southwest Corridor ParkTennis Courts,Park,Park ,,4.8,45,Paved walk with benches & water views,1 Ocean View Dr,42.319823,-71.039952
Whittemore Robbins House Park,Park,Park ,,4.2,223,"Park for tennis, baseball & aquatics",49 Fellsway W,42.279308,-71.059812
ams National Historical Park,Park,Park ,,4.6,38,Walking trail with views of the harbor,,42.370567,-71.026964
John Adams Birthplace Adams National Historical Park,Park,Park ,,4.2,211,Grassy space with an off leash dog area,43 Juliette St,42.305327,-71.062631
DoubleTree Suites by Hilton Hotel Boston Cambridge,Park,Park ,,4.4,14,Site for outdoor activities & a dog park,,42.370567,-71.026964
"Regus Massachusetts, Boston",Park,State park ,,4.7,2375,Recreational area with historic fort,2010 William J Day Blvd,42.337011,-71.011878
Boston Tango in the Park only in July & August,Park,Park ,,4.4,16,A serene park with a water fountain,,42.370567,-71.026964
DoubleTree by Hilton Hotel Boston Downtown,Park,Park ,,4,2,Public park with playgrounds & gardens,,42.370567,-71.026964
Brookline Parks and Open SpacePark Maintenance / Forestry,Park,Park ,,4.5,115,Multi use community recreation area,20 Grove St,42.360467,-71.068571
Marine Park,Park,Park ,,4.5,531,Grass covered space on the waterfront,49 Farragut Rd,42.336487,-71.025371
East Boston Memorial Park,Park,Park ,,4.6,276,Green space with a playground & fields,143 Porter St,42.372412,-71.034282
Lewis Mall Harbor Park,Park,Park ,,4.9,46,Park with live music & lawn games,65 Lewis St,42.367859,-71.041969
Seven Hills Park,Park,Park ,,4.2,39,Bocce ball courts & scenic surroundings,,42.370567,-71.026964
Gerard Bergin Park,Park,City park ,,4.5,27,Area with a carousel & ever changing art,Haskell St & Pemberton St,42.359995,-71.129126
Bremen Street Community Park,Park,Park ,,4.6,306,Park with spray fountain & public garden,Bremen Street,42.375269,-71.031617
Savin Hill and Malibu Beach,Park,State park ,,4.5,105,Park with ball fields & spray area,68 Denny St,42.308511,-71.051766
Harry Downes Field,Park,Park ,,4.5,93,Plaza & walkway with gardens & waterfall,24 Highland Rd,42.328986,-71.091541
Nathan Tufts Park,Park,Park ,,4.5,109,Small green space on Harborwalk trail,850 Broadway,42.335921,-71.030351
Mother's Rest Park at Four Corners,Park,Park ,,4.2,40,Historic site with panoramic views,,42.370567,-71.026964
Hilton Boston Back Bay,Park,4 Star Hotel,,4.2,1327,High rise hotel with a pool & dining,40 Dalton St,42.346467,-71.085261
Carson Beach,Park,Park ,,4.3,191,Walking trail with views of the harbor,165 HarborWalk,42.326552,-71.048845
John Corcoran Park Tenant Council,Park,Park ,,3.8,5,Grassy space with an off leash dog area,148 Corcoran Ln # J,42.377014,-71.154625
East Boston Piers Park,Park,Park ,,4.9,24,Recreational area with historic fort,Unnamed Road,42.370567,-71.026964
Alewife Reservation (Bullfinch Parking Lot),Park,Park ,,5,1,A serene park with a water fountain,8 Acorn Park Dr,42.357507,-71.069101
Demeter At The Park,Park,Point of interest ,,4,2,Public park with playgrounds & gardens,Brookline Ave,42.347037,-71.098886
Quigley Park,Park,Park ,,4,39,Multi use community recreation area,25 Essex St,42.352336,-71.061825
Danehy Dog Park,Park,Dog park ,,4.1,41,Grass covered space on the waterfront,166 New St,42.332225,-71.031041
Columbus Memorial Park,Park,Park ,,4.2,26,Green space with a playground & fields,Hicks Ave,42.370567,-71.026964
Watertown Riverfront Park and Braille Trail,Park,Park ,,4.6,52,Bocce ball courts & scenic surroundings,147 Charles River Rd #101,42.367071,-71.068071
Mystic River State Reservation,Park,State park ,,4.5,191,Park with many recreational options,Mystic Valley Pkwy,42.339981,-71.071258
Hodgkins Curtin Park,Park,Park ,,4.3,72,Neighborhood playground & baseball field,Holland St,42.312241,-71.085226
Dorchester Shores Reservation,Park,Park ,,4.7,35,Dog friendly park on a tiny island,Victory Rd,42.297526,-71.050091
Bellingham Hill Park,Park,Park ,,4.3,35,Plaza & walkway with gardens & waterfall,"Bellingham Hill, Bellingham St & Cottage St.",42.391234,-71.029105
Squantum Point Park,Park,State park ,,4.4,141,Waterfront area with city skyline views,Miwra Haul Rd,42.370567,-71.026964
